{
  "schema_version": "1.0.0",
  "release_id": "rel_20260709-0002bbbb",
  "commit_sha": "1b04bb58271b496a9e049e19016981716d789d1",
  "build_id": "build_prod-0002",
  "tenant_id": "cp04",
  "environment": "PRODUCTION",
  "deployment_profile": { "ref": "clients/club-padel-04/deployment-profile.json", "client_slug": "club-padel-04", "deployment_status": "ACTIVE" },
  "security_status": { "status": "PASS", "evidence_ref": "audit/security-hardening/10_PRODUCTION_SECURITY_READINESS.md", "checked_at": "2026-07-09T10:00:00.000Z" },
  "qa_status": { "status": "PASS", "evidence_ref": "clients/club-padel-04/QA_CHECKLIST.md", "checked_at": "2026-07-09T10:00:00.000Z" },
  "backup_status": { "status": "PASS", "evidence_ref": "fixtures/release/backup-status.snapshot.json", "checked_at": "2026-07-09T10:00:00.000Z" },
  "observability_status": { "status": "PASS", "evidence_ref": "audit/observability/20_EXACT_INTEGRATION_DIFF_PLAN.md", "checked_at": "2026-07-09T09:30:00.000Z" },
  "dependency_status": {
    "overall": { "status": "PASS", "evidence_ref": "fixtures/make-qa/dependency-status.json", "checked_at": "2026-07-09T10:00:00.000Z" },
    "stripe": { "status": "NOT_APPLICABLE", "evidence_ref": "config/client-config.schema.json#integrations.payments.enabled", "checked_at": "2026-07-09T09:00:00.000Z" },
    "whatsapp": { "status": "NOT_APPLICABLE", "evidence_ref": "config/client-config.schema.json#integrations.messaging.enabled", "checked_at": "2026-07-09T09:00:00.000Z" },
    "airtable": { "status": "PASS", "evidence_ref": "fixtures/make-qa/dependency-status.json", "checked_at": "2026-07-09T10:00:00.000Z" },
    "make_qa": { "status": "PASS", "evidence_ref": "fixtures/make-qa/manifest/release-readiness-matrix.json", "checked_at": "2026-07-09T00:00:00.000Z" }
  },
  "rollback_ref": { "previous_release_id": "rel_20260701-0000zzzz", "previous_commit_sha": "a1b2c3d", "trigger": "none", "owner": null },
  "approved_by": { "name": "Eduardo Rodriguez", "role": "direccion-agencia", "approved_at": "2026-07-09T10:04:00.000Z" },
  "created_at": "2026-07-09T10:05:00.000Z"
}
