{
  "schema_version": "1.0.0",
  "release_id": "rel_20260709-0001aaaa",
  "commit_sha": "1b04bb58271b496a9e049e19016981716d789d1",
  "build_id": "build_stg-0001",
  "tenant_id": "cp04",
  "environment": "STAGING",
  "deployment_profile": { "ref": "clients/club-padel-04/deployment-profile.json", "client_slug": "club-padel-04", "deployment_status": "STAGING_READY" },
  "security_status": { "status": "WARN", "evidence_ref": "audit/security-hardening/10_PRODUCTION_SECURITY_READINESS.md", "checked_at": "2026-07-09T10:00:00.000Z" },
  "qa_status": { "status": "PENDING", "evidence_ref": null, "checked_at": null },
  "backup_status": { "status": "UNKNOWN", "evidence_ref": null, "checked_at": null },
  "observability_status": { "status": "PASS", "evidence_ref": "audit/observability/20_EXACT_INTEGRATION_DIFF_PLAN.md", "checked_at": "2026-07-09T09:30:00.000Z" },
  "dependency_status": {
    "overall": { "status": "WARN", "evidence_ref": "fixtures/make-qa/dependency-status.json", "checked_at": "2026-07-08T00:00:00.000Z" },
    "stripe": { "status": "NOT_APPLICABLE", "evidence_ref": "config/client-config.schema.json#integrations.payments.enabled", "checked_at": "2026-07-09T09:00:00.000Z" },
    "whatsapp": { "status": "NOT_APPLICABLE", "evidence_ref": "config/client-config.schema.json#integrations.messaging.enabled", "checked_at": "2026-07-09T09:00:00.000Z" },
    "airtable": { "status": "WARN", "evidence_ref": "fixtures/make-qa/dependency-status.json", "checked_at": "2026-07-08T00:00:00.000Z" },
    "make_qa": { "status": "WARN", "evidence_ref": "fixtures/make-qa/manifest/release-readiness-matrix.json", "checked_at": "2026-07-09T00:00:00.000Z" }
  },
  "rollback_ref": { "previous_release_id": null, "previous_commit_sha": null, "trigger": "none", "owner": null },
  "approved_by": null,
  "created_at": "2026-07-09T10:05:00.000Z"
}
